{
  "report": "0.1",
  "title": "Stored cross-site scripting in the ticket view",
  "target": "support.example.com",
  "description": "The ticket subject is rendered without escaping, so markup submitted by one user runs in the browser of any agent opening the ticket.",
  "exploitation": {
    "state": "yes",
    "evidence": "Requests matching the payload appear in public scan data since 2026-08-01.",
    "observed_at": "2026-08-01T00:00:00Z"
  }
}
